{
  "_meta": { "stage": "check", "by": "示例" },
  "where": "某短视频",
  "claim": "蜂巢是蜜蜂一只一只量出来的六边形",
  "likes": "3万", "comments": "521",
  "clues": [
    "蜂蜡软的时候格子其实是圆的。",
    "挤在一起后圆圈自己变成了六边形。",
    "好几种昆虫搭巢都会出现类似的形状。"
  ],
  "truth": "false",
  "verdict": "假的！六边形是软蜂蜡挤压后自然形成的，不是量出来的。",
  "explain": "蜜蜂先做出圆形小房间，蜂蜡变软后彼此挤压，角度自然变成接近 120 度的六边形。",
  "sources": ["https://example.org/g", "https://example.org/h"]
}
