{
  "_meta": {
    "stage": "check",
    "by": "示例"
  },
  "where": "一段讲极昼的短视频",
  "claim": "极昼时，太阳一直停在同一个位置。",
  "clues": [
    "先找一段连续拍摄的极昼视频。",
    "看太阳和地平线的位置有没有改变。",
    "再比较另一个地点拍到的轨迹。"
  ],
  "truth": "false",
  "verdict": "假：太阳仍会在天空中移动。",
  "explain": "极昼表示太阳整天不落到地平线下，不表示太阳在天空中的位置不变。",
  "sources": [
    "https://aa.usno.navy.mil/faq/eqtime",
    "https://pmel.noaa.gov/arctic-zone/gallery_np_seasons.html"
  ]
}
